{
  "$schema": "https://json-schema.org/draft/2020-12/schema",
  "$id": "https://sqoia.com/schemas/ood-pbs-file-restore-site-v1.json",
  "title": "PBS File Restore site configuration",
  "type": "object",
  "additionalProperties": false,
  "required": ["schema_version", "deployment_model", "broker", "portal", "app"],
  "properties": {
    "schema_version": {"const": 1},
    "deployment_model": {"const": "shared-home-v1"},
    "broker": {
      "type": "object", "additionalProperties": false,
      "required": ["backup_type", "archive_name", "catalog_name", "home_root", "staging_root", "snapshot_max_age_days", "secret_env_file"],
      "properties": {
        "backup_type": {"const": "host"},
        "archive_name": {"type": "string", "pattern": "^[A-Za-z0-9][A-Za-z0-9._-]{0,127}$", "not": {"pattern": "[\\u0000-\\u001F\\u007F]"}},
        "catalog_name": {"type": "string", "pattern": "^[A-Za-z0-9][A-Za-z0-9._-]{0,127}$", "not": {"pattern": "[\\u0000-\\u001F\\u007F]"}},
        "home_root": {"type": "string", "minLength": 2, "maxLength": 512, "pattern": "^/(?!.*(?:/\\.{1,2}(?:/|$)|//)).*[^/]$"},
        "staging_root": {"type": "string", "minLength": 2, "maxLength": 512, "pattern": "^/(?!.*(?:/\\.{1,2}(?:/|$)|//)).*[^/]$"},
        "snapshot_max_age_days": {"type": "integer", "minimum": 1, "maximum": 366},
        "secret_env_file": {"type": "string", "minLength": 2, "maxLength": 512, "pattern": "^/(?!.*(?:/\\.{1,2}(?:/|$)|//)).*[^/]$"}
      }
    },
    "portal": {
      "type": "object", "additionalProperties": false,
      "required": ["broker_ssh_target", "ssh_private_key", "known_hosts", "client_path"],
      "properties": {
        "broker_ssh_target": {"type": "string", "maxLength": 255, "pattern": "^root@(?!.*\\.\\.)[A-Za-z0-9](?:[A-Za-z0-9.-]{0,251}[A-Za-z0-9])?$", "not": {"pattern": "[\\u0000-\\u001F\\u007F]"}},
        "ssh_private_key": {"type": "string", "minLength": 2, "maxLength": 512, "pattern": "^/(?!.*(?:/\\.{1,2}(?:/|$)|//)).*[^/]$"},
        "known_hosts": {"type": "string", "minLength": 2, "maxLength": 512, "pattern": "^/(?!.*(?:/\\.{1,2}(?:/|$)|//)).*[^/]$"},
        "client_path": {"type": "string", "minLength": 2, "maxLength": 512, "pattern": "^/(?!.*(?:/\\.{1,2}(?:/|$)|//)).*[^/]$"}
      }
    },
    "app": {
      "type": "object", "additionalProperties": false,
      "required": ["name", "description", "support_url", "restore_directory_name"],
      "properties": {
        "name": {"type": "string", "minLength": 1, "maxLength": 120, "pattern": "^[^\\u0000-\\u001F\\u007F]+$"},
        "description": {"type": "string", "minLength": 1, "maxLength": 300, "pattern": "^[^\\u0000-\\u001F\\u007F]+$"},
        "support_url": {"type": "string", "maxLength": 500, "pattern": "^https://[^/@?#]+(?:/[^?#]*)?$"},
        "restore_directory_name": {"type": "string", "pattern": "^(?!\\.{1,2}$)[A-Za-z0-9._-]{1,128}$"}
      }
    }
  }
}
